### ISSUE TITLE
SmtpClient DisconnectAsync may not exit with an improperly closed remote connection

### ISSUE THREAD

**Issue by tvalenta** [jstedfast/MailKit#827]
**Describe the bug**
DisconnectAsync can block when packets to a previously functioning session are suddenly dropped. Despite many attempts, I'm unable to get a cancellation token to end the task by setting a timer with `CancelAfter`.

I have a process which terminates a client session as such: 
```
      var client = new SmtpClient ();   
     .... mail processing here...
     // Send and close
      await client.SendAsync(mimeMessage).ConfigureAwait(false);
      await client.DisconnectAsync(true).ConfigureAwait(false);
```
Occasionally, this job will hang -- typically always while connecting to an office365.com MTA. I'm unable to reproduce the behavior in production, and resorted to creating an artificial experience with  packet filtering on a FreeBSD-based mail server. When dropping packets from the client just prior to the invocation of DisconnectAsync, my client session never ends. I attempted to rectify by passing a Cancellation Token to DisconnectAsync, but the connection continued to hang indefinitely. Calling instead `Disconnect(true)`, it appears the session will close when the stream timeout is reached. (i.e. to whatever value I've set `client.Timeout`)

**To Reproduce**
1. Create a new SmtpClient connection to a remote mail server.
1. Prior to calling `DisconnectAsync()`, sleep for 10 seconds
1. While MailKit SMTP client process sleeps, use a firewall to drop packets from the client to the mail server.
   - For my tests, I used the FreeBSD packet filtering abilities, but I could have used any intermediate firewall. e.g.
   - `sudo ipfw add 1000 drop ip from me to  <client IP address> src-port 25`
4. See session not close

**Expected behavior**
Expected would be the session to close after the default 120 second timeout, or allow a cancellation token to abort the task.

**Screenshots**

**Desktop (please complete the following information):**
 - OS: MacOS Mojave

**Additional context**

**Comment by jstedfast** [comment]
Are you saying you switched from `DisconnectAsync(true)` to `Disconnect (true)`? Or `DisconnectAsync (false)` to `DisconnectAsync (true)`?

**Comment by tvalenta** [comment]
I switched from `DisconnectAsync(true)` to `Disconnect(true)`.

**Comment by jstedfast** [comment]
I can't actually test your scenario because I do not have a system where I can easily use firewall commands such as ipfw.

Can you test the above fix?

**Comment by tvalenta** [comment]
Is there a test build that I can reference in my project, or do I need to build from the Github sources?

**Comment by jstedfast** [comment]
https://dev.azure.com/jestedfa/_apis/resources/Containers/780959?itemPath=MailKit-2.1.3.3%2FMailKit.2.1.3.3.nupkg

**Comment by tvalenta** [comment]
My login to live.com wasn't working, but I'd built a local copy. (Note - I'm running on MacOS with netcoreapp2.1. I failed to mention this earlier). This is what I've observed:

1. Calling `Disconnect` with CTS token
     ``` 
   Thread.Sleep(5000);
   CancellationTokenSource cts = new CancellationTokenSource(); 
   cts.CancelAfter(TimeSpan.FromSeconds(10));
   client.Disconnect(true,cts.Token); 
   ```
   -  this cancels after the Token expires. In the following wireshark output, `Thread.Sleep` occurred at line 21. Line 22 starts `Disconnect`, and 10 seconds later the socket is closed.  (Local connection goes into FIN_WAIT_1 as would be expected). I tried to catch the TaskCanceledException so I could log something being amiss, but I see where it's swallowed by `OperationCanceledException` in DisconnectAsync.
   ```
   20   1.567275 192.168.2.32 → 192.168.2.25 SMTP 122 S: 250 2.0.0 x2BK2anR089726 Message accepted for delivery
   21   1.567335 192.168.2.25 → 192.168.2.32 TCP 66 51976 → 25 [ACK] Seq=279 Ack=484 Win=131264 Len=0 TSval=2228714155 TSecr=2484318041
   22   6.577782 192.168.2.25 → 192.168.2.32 SMTP 72 C: QUIT
   23   7.047115 192.168.2.25 → 192.168.2.32 TCP 72 [TCP Retransmission] 51976 → 25 [PSH, ACK] Seq=279 Ack=484 Win=131264 Len=6 TSval=2228719609 TSecr=2484318041
   24   7.562430 192.168.2.25 → 192.168.2.32 TCP 72 [TCP Retransmission] 51976 → 25 [PSH, ACK] Seq=279 Ack=484 Win=131264 Len=6 TSval=2228720122 TSecr=2484318041
   25   8.388257 192.168.2.25 → 192.168.2.32 TCP 72 [TCP Retransmission] 51976 → 25 [PSH, ACK] Seq=279 Ack=484 Win=131264 Len=6 TSval=2228720946 TSecr=2484318041
   26   9.842146 192.168.2.25 → 192.168.2.32 TCP 72 [TCP Retransmission] 51976 → 25 [PSH, ACK] Seq=279 Ack=484 Win=131264 Len=6 TSval=2228722394 TSecr=2484318041
   27  12.563808 192.168.2.25 → 192.168.2.32 TCP 72 [TCP Retransmission] 51976 → 25 [PSH, ACK] Seq=279 Ack=484 Win=131264 Len=6 TSval=2228725090 TSecr=2484318041
   28  16.669305 192.168.2.25 → 192.168.2.32 TCP 66 51976 → 25 [FIN, ACK] Seq=285 Ack=484 Win=131264 Len=0 TSval=2228729183 TSecr=2484318041
   29  17.772403 192.168.2.25 → 192.168.2.32 TCP 72 [TCP Retransmission] 51976 → 25 [FIN, PSH, ACK] Seq=279 Ack=484 Win=131264 Len=6 TSval=2228730283 TSecr=2484318041
   30  26.928900 192.168.2.25 → 192.168.2.32 TCP 72 [TCP Retransmission] 51976 → 25 [FIN, PSH, ACK] Seq=279 Ack=484 Win=131264 Len=6 TSval=2228739411 TSecr=2484318041
   ```
1. Calling `Disconnect(true,cts.Token)` and also setting `client.Timeout`
     ``` 
   Thread.Sleep(5000);
   client.Timeout = 5000;
   CancellationTokenSource cts = new CancellationTokenSource(); 
   cts.CancelAfter(TimeSpan.FromSeconds(10));
   client.Disconnect(true,cts.Token); 
    ```
   - Client disconnects after 10 seconds (token expiration reached). The client.Timeout value doesn't end things earlier.
1. Calling `Disconnect(true)` and also setting `client.Timeout` to a shorter value.
     ``` 
   Thread.Sleep(5000);
   client.Timeout = 5000;
   CancellationTokenSource cts = new CancellationTokenSource(); 
   cts.CancelAfter(TimeSpan.FromSeconds(10));
   client.Disconnect(true); 
    ```
   - Client disconnects after 5 seconds.
1. Calling `DisconnectAsync(true,cts.Token)`
      ```
        await client.DisconnectAsync(true,cts.Token).ConfigureAwait(false);
      ```
    - Connection closes after 105-110 seconds. CancellationToken does not appear to matter.
1. Calling `DisconnectAsync(true)`
      ```
        await client.DisconnectAsync(true).ConfigureAwait(false);
      ```
    - Connection closes after 105-110 seconds. Same behavior as with the cancellation token.

With any of these, it appears I should no longer risk a connection permanently blocking. I don't understand why DisconnectAsync waits the 105-110 seconds before returning. Can you illuminate me?

**Comment by jstedfast** [comment]
I can explain 2:

In the non-async case, if the cancellation token is cancellable, then the client polls the socket waiting for it to be ready to accept a `write` while also listening for a cancel event from the cancellation token. Because the socket is not actually being used to read or write, the `Timeout` property is never used.

And 3:

Since the token isn't cancellable (no token used), it immediately goes to `write` the data to the socket which then expires after the timeout.

4 and 5:

Why doesn't that work for async? I have no idea. It should unless the NetworkStream/SslStream don't respect the `Timeout` property for their `WriteAsync` method.

**Comment by jstedfast** [comment]
The change I made forces the disconnect of the socket as soon as the token is cancelled, so I don't understand how that would not cause NetworkStream/SslStream.WriteAsync() to not immediately get an IOException or SocketException or something, which should abort the WriteAsync.

**Comment by jstedfast** [comment]
BTW, I now have a MyGet nuget feed that you can use to test this: https://www.myget.org/feed/mimekit/package/nuget/MailKit

Would you mind checking to see if the latest builds work for you?

**Comment by tvalenta** [comment]
This build worked for me. As before, I'm unable to get DisconnectAsync to follow the CancellationToken.
```
await client.DisconnectAsync(true,cts.Token).ConfigureAwait(false);
await client.DisconnectAsync(true).ConfigureAwait(false);
await client.DisconnectAsync(true);
```
The following all behaved identically for me -- returning after 105 seconds, regardless of the cancellation token. This would no longer block on the occasional network failure, but for now I've chosen`client.Disconnect(true,cts.Token);` since I a) can control the timeout value and b) understand what triggers it.

Thank you for the help!

**Comment by jstedfast** [comment]
I just committed another potential fix that may improve things which will show up in the myget feed as soon as CI finishes building it. Could you test that as well? I want to try and make it so that cancelling the cancellationToken is immediate.

**Comment by tvalenta** [comment]
Same behavior. Could it be related to the topic of this thread? https://stackoverflow.com/questions/12421989/networkstream-readasync-with-a-cancellation-token-never-cancels

**Comment by jstedfast** [comment]
Okay, just tried writing my own custom NetworkStream using Socket.SendAsync/ReceiveAsync so that I could cancel by aborting the connection.

Is this any better for `DisconnectAsync(true, cts.Token).ConfigureAwait (false)`?

The package version will be 2.1.3.7 when CI finishes building.

**Comment by jstedfast** [comment]
Commits were: https://github.com/jstedfast/MailKit/commit/e4dd6303526e42edf9516e2c0b1e194a0041af8d and https://github.com/jstedfast/MailKit/commit/2137a6f456ace5180c47de88afda73a2f942b25e

**Comment by jstedfast** [comment]
If this doesn't fix it, I have 1 more idea which is to drop the `socket.Shutdown()` call and just keep the `socket.Dispose()`

**Comment by tvalenta** [comment]
Success! The command still returns for me after 105 seconds if I don't provide the Cancellation Token. With the token, I can exit earlier.
As something for consideration, I would find it desirable for DisconnectAsync to not swallow the `OperationCanceledException` exception. Now that DisconnectAsync doesn't cause my client to hang indefinitely, I could make use of logging when there are problems sending the disconnect and figure out if it's a problem on my network, or with only with Office365.

Thanks for all the effort.

**Comment by jstedfast** [comment]
Normally a OperationCanceledException would indicate that the method failed, but in the case of Disconnect[Async], we want it to always succeed.

In other words, the cancellation only cancels the *command* being sent, but the connection is still dropped.

Seems like it might be awkward to emit the exception.

**Comment by tvalenta** [comment]
You're totally correct. Is there a way to directly send commands, such as explicitly sending the QUIT command, and then calling Disconnect?

**Comment by jstedfast** [comment]
No :-\

Would checking `cancellationToken.IsCancelled` be enough?

**Comment by tvalenta** [comment]
Brilliant!

**Comment by tvalenta** [comment]
I finally caught this behavior in production. At least that time, I believe it got stuck on `await client.AuthenticateAsync(userName, password).ConfigureAwait(false);` (I was able to confirm that the mail had not been sent to the MTA, so the process had to have become stuck before `SendAsync`. Since AuthenticateAsync also uses `SendCommandAsync` I presume it was the same behavior as if packets being lost in `DisconnectAsync` and additional testing showed that 2.1.3.7 should hopefully work better. Any idea when the next release might happen?

**Comment by jstedfast** [comment]
I might have time this weekend.

**Comment by alexxie** [comment]
We are experiencing similiar issue: await smtpclient.SendAsync(message) does to return. 

The application is:
- .net core 2.2 app running on AKS 
- mailkit 2.4.1
- connecting to O365 smtp server

There is not particular pattern when the issue will happen. The app sends 1000 mail per day and it could run for weeks without issue or the issue happens after a few days.

Any help is greatly appreciated.

**Comment by jstedfast** [comment]
@alexxie Have you tried using the cancellation token? If not, have you tried waiting to get an exception? What is the stracktrace of that exception?

**Comment by alexxie** [comment]
No, I have not tried using the cancellatioon token. There was no exception thrown, seems like the call just got stucked and never returned.

**Comment by jstedfast** [comment]
TCP/IP socket timeouts can take several minutes at least to timeout.

If it hangs indefinitely, I'm not sure how to reproduce that because I won't know where the hang is occurring unless you can capture it happening within Visual Studio in the debugger and giving me the call stack.

**Comment by alexxie** [comment]
Ok, let me try if I can make it to happen in VS. Thanks for your quick response.

**Comment by alexxie** [comment]
Do you think it will be more likely to throw exception if I change to use the Send(...) method instead? And with the cancellation token?

**Comment by jstedfast** [comment]
It's possible.

**Comment by MaximBalaganskiy** [comment]
I recon this should be reopened. We're experiencing the same issue with MailKit@2.5.2 and office365 and not other providers. I'm waiting for a client to update the app to log exactly which method hangs.

**Comment by alexxie** [comment]
@jstedfast suggested to create and pass the CancellationToken to the Open, Connect and Send calls. I did that and issue is no longer happening.

**Comment by MaximBalaganskiy** [comment]
So, basically, `SmtpClient.Timeout` is useless and has to be replaced by an external one?

**Comment by jstedfast** [comment]
@MaximBalaganskiy are you using the sync or async API?

If you are using the sync API, then the following loop is used to "wait" until the socket will accept data and then Socket.Send() is called: https://github.com/jstedfast/MailKit/blob/master/MailKit/Net/SocketUtils.cs#L110

If you are using the Async API, then this underlying NetworkStream WriteAsync() method gets called: https://github.com/jstedfast/MailKit/blob/master/MailKit/Net/NetworkStream.cs#L199

If you are using the async API, my *guess* is that the `Socket.Shutdown(Both)` call is what is hanging for you, but I can't know that unless someone debugs this for me and lets me know exactly what is happening because I can't reproduce it.

**Comment by jstedfast** [comment]
FWIW, this may be helpful to you: https://docs.microsoft.com/en-us/dotnet/framework/network-programming/network-tracing?view=netframework-4.8

**Comment by MaximBalaganskiy** [comment]
We're using async Api. I don't think we go as far as shutdown, as clients don't get emails.
I'll deploy the fix with an external timeout and post back.

**Comment by alexxie** [comment]
If you use the CancellationToken approach, be sure you catch the OperationCanceledException then retry sending. This gives your code the chance to resend instead of waiting indefinitely.

**Comment by jstedfast** [comment]
I did some reading of the .NET Socket API and apparently, when the asynchronous send/receive methods are used, the socket timeouts are not used.

So yea... the solution is to use CancellationToken.

**Comment by jstedfast** [comment]
@MaximBalaganskiy I've updated MailKit's custom NetworkStream implementation's ReadAsync() and WriteAsync() to create CancellationTokenSources that timeout after the appropriate timeout interval (`Stream.ReadTimeout` vs `Stream.WriteTimeout`) which will hopefully solve your issue.

That said, it's all about user-initiated cancellation ;-)
